{
  "schema_version": "goal-teams-prompt-manifest-v2.50",
  "generation_id": "V2.65",
  "manifest_state": "active_current",
  "ordering_rule": "core_then_routing_then_assurance_then_functions_then_contracts",
  "path_deduplication_rule": "reject_duplicate_repo_relative_posix_paths",
  "byte_count_algorithm": "sum_raw_file_bytes_after_path_deduplication",
  "current_rule_allowlist": [
    "references/current/generations/V2.65/core.md",
    "references/current/generations/V2.65/routing.md",
    "references/current/generations/V2.65/assurance-levels.md",
    "references/current/generations/V2.65/functions/requirements.md",
    "references/current/generations/V2.65/functions/architecture-implementation.md",
    "references/current/generations/V2.65/functions/testing.md",
    "references/current/generations/V2.65/functions/ui-desktop.md",
    "references/current/generations/V2.65/functions/agent-runtime.md",
    "references/current/generations/V2.65/functions/graph-engineering.md",
    "references/current/generations/V2.65/functions/knowledge-graph.md",
    "references/current/generations/V2.65/functions/release-operations.md",
    "references/current/generations/V2.65/contracts/task-state.md",
    "references/current/generations/V2.65/contracts/test-case-gate.md",
    "references/current/generations/V2.65/contracts/harness-evidence.md",
    "references/current/generations/V2.65/contracts/review-completion.md",
    "references/current/generations/V2.65/contracts/loop-evolution.md",
    "references/current/generations/V2.65/contracts/approval-side-effects.md"
  ],
  "routes": {
    "V250-ROUTE-STARTUP": {
      "assurance_level": "Lite",
      "workflow_phase": "startup",
      "ordered_refs": [
        "references/current/generations/V2.65/core.md",
        "references/current/generations/V2.65/routing.md",
        "references/current/generations/V2.65/assurance-levels.md",
        "references/current/generations/V2.65/contracts/task-state.md",
        "references/current/generations/V2.65/contracts/approval-side-effects.md",
        "references/current/generations/V2.65/contracts/test-case-gate.md",
        "references/current/generations/V2.65/contracts/harness-evidence.md",
        "references/current/generations/V2.65/contracts/review-completion.md"
      ],
      "required_gates": [],
      "conditional_gates": [
        "project_start_authorization"
      ],
      "manual_artifact_count": 0,
      "governance_time": "minimal",
      "max_loaded_rule_bytes": 72194,
      "expected_loaded_rule_bytes": 24347
    },
    "V250-ROUTE-DISCUSSION": {
      "assurance_level": "Discussion",
      "workflow_phase": "discussion",
      "ordered_refs": [
        "references/current/generations/V2.65/core.md",
        "references/current/generations/V2.65/routing.md",
        "references/current/generations/V2.65/assurance-levels.md",
        "references/current/generations/V2.65/functions/requirements.md",
        "references/current/generations/V2.65/contracts/task-state.md",
        "references/current/generations/V2.65/contracts/test-case-gate.md",
        "references/current/generations/V2.65/contracts/harness-evidence.md",
        "references/current/generations/V2.65/contracts/review-completion.md",
        "references/current/generations/V2.65/contracts/approval-side-effects.md"
      ],
      "required_gates": [],
      "conditional_gates": [],
      "manual_artifact_count": 0,
      "governance_time": "discussion_only",
      "max_loaded_rule_bytes": 72194,
      "expected_loaded_rule_bytes": 27024
    },
    "V250-ROUTE-SMALL-DEVELOPMENT": {
      "assurance_level": "Lite",
      "workflow_phase": "development",
      "ordered_refs": [
        "references/current/generations/V2.65/core.md",
        "references/current/generations/V2.65/routing.md",
        "references/current/generations/V2.65/assurance-levels.md",
        "references/current/generations/V2.65/functions/requirements.md",
        "references/current/generations/V2.65/functions/architecture-implementation.md",
        "references/current/generations/V2.65/functions/testing.md",
        "references/current/generations/V2.65/functions/agent-runtime.md",
        "references/current/generations/V2.65/functions/graph-engineering.md",
        "references/current/generations/V2.65/functions/knowledge-graph.md",
        "references/current/generations/V2.65/contracts/task-state.md",
        "references/current/generations/V2.65/contracts/test-case-gate.md",
        "references/current/generations/V2.65/contracts/harness-evidence.md",
        "references/current/generations/V2.65/contracts/review-completion.md",
        "references/current/generations/V2.65/contracts/loop-evolution.md",
        "references/current/generations/V2.65/contracts/approval-side-effects.md"
      ],
      "required_gates": [
        "loop_bootstrap",
        "environment_preflight",
        "tdd",
        "incremental"
      ],
      "conditional_gates": [
        "development_environment_check",
        "project_start_authorization",
        "independent_review"
      ],
      "manual_artifact_count": 1,
      "governance_time": "light",
      "max_loaded_rule_bytes": 72194,
      "expected_loaded_rule_bytes": 51781
    },
    "V250-ROUTE-MEDIUM-DEVELOPMENT": {
      "assurance_level": "Standard",
      "workflow_phase": "development",
      "ordered_refs": [
        "references/current/generations/V2.65/core.md",
        "references/current/generations/V2.65/routing.md",
        "references/current/generations/V2.65/assurance-levels.md",
        "references/current/generations/V2.65/functions/requirements.md",
        "references/current/generations/V2.65/functions/architecture-implementation.md",
        "references/current/generations/V2.65/functions/testing.md",
        "references/current/generations/V2.65/functions/agent-runtime.md",
        "references/current/generations/V2.65/functions/graph-engineering.md",
        "references/current/generations/V2.65/functions/knowledge-graph.md",
        "references/current/generations/V2.65/contracts/task-state.md",
        "references/current/generations/V2.65/contracts/test-case-gate.md",
        "references/current/generations/V2.65/contracts/harness-evidence.md",
        "references/current/generations/V2.65/contracts/review-completion.md",
        "references/current/generations/V2.65/contracts/loop-evolution.md",
        "references/current/generations/V2.65/contracts/approval-side-effects.md"
      ],
      "required_gates": [
        "loop_bootstrap",
        "environment_preflight",
        "development_environment_check",
        "tdd",
        "incremental"
      ],
      "conditional_gates": [
        "semantic_review",
        "behavior_review",
        "project_start_authorization"
      ],
      "manual_artifact_count": 2,
      "governance_time": "standard",
      "max_loaded_rule_bytes": 72194,
      "expected_loaded_rule_bytes": 51781
    },
    "V250-ROUTE-LARGE-DEVELOPMENT": {
      "assurance_level": "Full",
      "workflow_phase": "development",
      "ordered_refs": [
        "references/current/generations/V2.65/core.md",
        "references/current/generations/V2.65/routing.md",
        "references/current/generations/V2.65/assurance-levels.md",
        "references/current/generations/V2.65/functions/requirements.md",
        "references/current/generations/V2.65/functions/architecture-implementation.md",
        "references/current/generations/V2.65/functions/testing.md",
        "references/current/generations/V2.65/functions/agent-runtime.md",
        "references/current/generations/V2.65/functions/graph-engineering.md",
        "references/current/generations/V2.65/functions/knowledge-graph.md",
        "references/current/generations/V2.65/contracts/task-state.md",
        "references/current/generations/V2.65/contracts/test-case-gate.md",
        "references/current/generations/V2.65/contracts/harness-evidence.md",
        "references/current/generations/V2.65/contracts/review-completion.md",
        "references/current/generations/V2.65/contracts/loop-evolution.md",
        "references/current/generations/V2.65/contracts/approval-side-effects.md"
      ],
      "required_gates": [
        "loop_bootstrap",
        "environment_preflight",
        "development_environment_check",
        "tdd",
        "incremental"
      ],
      "conditional_gates": [
        "semantic_review",
        "behavior_review",
        "completion_audit",
        "project_start_authorization"
      ],
      "manual_artifact_count": 3,
      "governance_time": "full_development",
      "max_loaded_rule_bytes": 72194,
      "expected_loaded_rule_bytes": 51781
    },
    "V250-ROUTE-UI-DESKTOP": {
      "assurance_level": "Full",
      "workflow_phase": "development",
      "ordered_refs": [
        "references/current/generations/V2.65/core.md",
        "references/current/generations/V2.65/routing.md",
        "references/current/generations/V2.65/assurance-levels.md",
        "references/current/generations/V2.65/functions/requirements.md",
        "references/current/generations/V2.65/functions/architecture-implementation.md",
        "references/current/generations/V2.65/functions/testing.md",
        "references/current/generations/V2.65/functions/ui-desktop.md",
        "references/current/generations/V2.65/functions/agent-runtime.md",
        "references/current/generations/V2.65/functions/graph-engineering.md",
        "references/current/generations/V2.65/functions/knowledge-graph.md",
        "references/current/generations/V2.65/contracts/task-state.md",
        "references/current/generations/V2.65/contracts/test-case-gate.md",
        "references/current/generations/V2.65/contracts/harness-evidence.md",
        "references/current/generations/V2.65/contracts/review-completion.md",
        "references/current/generations/V2.65/contracts/loop-evolution.md",